{
  "task_id": "erpnext-open-item-inventory-tab-001",
  "title": "Open The Seeded ERPNext Item Inventory Tab",
  "goal": "Sign in to ERPNext, open the seeded item record, and switch to the Inventory tab.",
  "instruction": "Open the ERPNext route for item NEXUI-ITEM-001, sign in as Administrator with password admin, switch to the Inventory tab, and stop once the inventory settings are visible.",
  "url": "http://localhost:8090/app/item/NEXUI-ITEM-001",
  "source": {
    "site_id": "erpnext-self-hosted",
    "site_name": "ERPNext Self-Hosted",
    "category": "other",
    "redistribution_class": "redistributable_source"
  },
  "source_surface": "erpnext-self-hosted",
  "risk_level": "safe",
  "allowed_actions": [
    "click",
    "type",
    "finish"
  ],
  "difficulty_band": "hard",
  "difficulty_dimensions": {
    "authentication_required": true,
    "meaningful_action_count": 4,
    "cross_view_verification": false,
    "summary_edit_propagation": false,
    "conditional_ui": true,
    "async_or_modal": false,
    "dense_controls": true,
    "safety_boundary": false
  },
  "split": "dev",
  "stability_runs_passed": 1,
  "tags": [
    "recorded",
    "erpnext",
    "authenticated",
    "item-detail",
    "inventory-tab",
    "hard"
  ],
  "review_notes": "Fixture-backed ERPNext item task that switches to the Inventory tab on the seeded item record.",
  "success_assertions": [
    {
      "type": "text_present",
      "artifact": "reader_view",
      "value": "Default Material Request Type"
    },
    {
      "type": "candidate_exists",
      "match": {
        "role": "tab",
        "name": "Inventory"
      }
    }
  ],
  "steps": [
    {
      "action": {
        "type": "type",
        "target_role": "textbox",
        "target_name": "Email",
        "text": "Administrator"
      },
      "explanation": "I entered the seeded ERPNext administrator login."
    },
    {
      "action": {
        "type": "type",
        "target_role": "textbox",
        "target_name": "Password",
        "text": "admin"
      },
      "explanation": "I entered the seeded ERPNext password."
    },
    {
      "action": {
        "type": "click",
        "target_role": "button",
        "target_name": "Login"
      },
      "explanation": "I signed in so ERPNext can redirect back to the seeded item detail page.",
      "wait_until": "networkidle",
      "post_delay_ms": 2000,
      "postconditions": [
        {
          "type": "url_contains",
          "value": "/desk/item/NEXUI-ITEM-001"
        }
      ],
      "postcondition_timeout_ms": 30000,
      "postcondition_poll_interval_ms": 250
    },
    {
      "action": {
        "type": "click",
        "target_role": "tab",
        "target_name": "Inventory"
      },
      "explanation": "I switched to the Inventory tab on the seeded item record.",
      "post_delay_ms": 1500
    },
    {
      "action": {
        "type": "finish",
        "summary": "I opened the seeded ERPNext item and switched to the Inventory tab."
      },
      "explanation": "The Inventory settings are visible now, so I am ending the task."
    }
  ]
}
