{
  "task_id": "govuk-service-updates-validation-001",
  "title": "Recover From Missing Updates Selection",
  "goal": "Reach the updates question, trigger the missing-selection validation error, recover from it, and stop on the check-answers page.",
  "instruction": "Complete the travel support prototype until the updates question. If the page rejects a missing selection, correct it and continue to the check-answers page.",
  "path": "../../../examples/sites/govuk-service-prototype/index.html",
  "source": {
    "site_id": "govuk-service-prototype-local",
    "site_name": "Local GOV.UK Service Prototype",
    "category": "government_pattern",
    "redistribution_class": "redistributable_source"
  },
  "risk_level": "safe",
  "allowed_actions": [
    "click",
    "type",
    "finish"
  ],
  "tags": [
    "recorded",
    "service-form",
    "validation",
    "recovery",
    "branching"
  ],
  "success_assertions": [
    {
      "type": "url_contains",
      "value": "#/check-answers"
    },
    {
      "type": "text_present",
      "artifact": "reader_view",
      "value": "No"
    },
    {
      "type": "text_absent",
      "artifact": "reader_view",
      "value": "Email address"
    }
  ],
  "steps": [
    {
      "action": {
        "type": "type",
        "target_role": "textbox",
        "target_name": "Full name",
        "text": "Amina Patel"
      },
      "explanation": "I entered the applicant name so the service can move to the next question."
    },
    {
      "action": {
        "type": "click",
        "target_role": "button",
        "target_name": "Continue"
      },
      "explanation": "The name is complete, so I am moving to the updates question.",
      "postconditions": [
        {
          "type": "url_contains",
          "value": "#/updates"
        }
      ]
    },
    {
      "action": {
        "type": "click",
        "target_role": "button",
        "target_name": "Continue"
      },
      "explanation": "The page should now report that no updates option was selected yet.",
      "postconditions": [
        {
          "type": "text_present",
          "artifact": "reader_view",
          "value": "Select whether you want email updates"
        }
      ]
    },
    {
      "action": {
        "type": "click",
        "target_role": "radio",
        "target_name": "No",
        "target_text": "No"
      },
      "explanation": "I selected no email updates to satisfy the missing required choice."
    },
    {
      "action": {
        "type": "click",
        "target_role": "button",
        "target_name": "Continue"
      },
      "explanation": "The required choice is now set, so I am moving to the review page.",
      "postconditions": [
        {
          "type": "url_contains",
          "value": "#/check-answers"
        },
        {
          "type": "text_present",
          "artifact": "reader_view",
          "value": "Check your answers before sending your application"
        }
      ]
    },
    {
      "action": {
        "type": "finish",
        "summary": "I recovered from the missing updates selection and reached the check-answers page on the no-email branch."
      },
      "explanation": "The review page is visible with the corrected branch, so I am ending the task."
    }
  ],
  "url": "file:///home/santosh/NeXUI/examples/sites/govuk-service-prototype/index.html"
}
