{
  "task_id": "govuk-benefits-self-employed-result-001",
  "title": "Review The Self-Employed Route At Check Answers",
  "goal": "Complete the benefits-eligibility journey on a self-employed route and stop on the check-answers page with the route details visible.",
  "instruction": "Complete the childcare-support eligibility prototype using a self-employed route and stop on the final check-answers page once the review summary is shown.",
  "path": "../../../examples/sites/govuk-benefits-eligibility-prototype/index.html",
  "source": {
    "site_id": "govuk-benefits-eligibility-prototype-local",
    "site_name": "Local GOV.UK Benefits Eligibility Prototype",
    "category": "government_pattern",
    "redistribution_class": "redistributable_source"
  },
  "source_surface": "govuk-benefits-eligibility-prototype-local",
  "risk_level": "safe",
  "allowed_actions": [
    "click",
    "type",
    "finish"
  ],
  "difficulty_band": "hard",
  "difficulty_dimensions": {
    "authentication_required": false,
    "meaningful_action_count": 10,
    "cross_view_verification": true,
    "summary_edit_propagation": false,
    "conditional_ui": true,
    "async_or_modal": false,
    "dense_controls": false,
    "safety_boundary": false
  },
  "split": "dev",
  "stability_runs_passed": 1,
  "tags": [
    "recorded",
    "service-form",
    "eligibility-prototype",
    "check-answers",
    "hard"
  ],
  "review_notes": "Hard review-page task that exercises the self-employed branch and keeps the route-specific answers visible in the final summary.",
  "success_assertions": [
    {
      "type": "url_contains",
      "value": "#/check-answers"
    },
    {
      "type": "text_present",
      "artifact": "reader_view",
      "value": "Self-employed"
    },
    {
      "type": "text_present",
      "artifact": "reader_view",
      "value": "2650"
    },
    {
      "type": "text_present",
      "artifact": "reader_view",
      "value": "No"
    }
  ],
  "steps": [
    {
      "action": {
        "type": "click",
        "target_role": "radio",
        "target_name": "Yes"
      },
      "explanation": "I selected Yes because the applicant usually lives in the UK."
    },
    {
      "action": {
        "type": "click",
        "target_role": "button",
        "target_name": "Continue"
      },
      "explanation": "The residency answer is complete, so I am moving to the childcare question.",
      "postconditions": [
        {
          "type": "url_contains",
          "value": "#/children"
        }
      ]
    },
    {
      "action": {
        "type": "click",
        "target_role": "radio",
        "target_name": "3 or more children"
      },
      "explanation": "I selected the highest childcare-count option for this route."
    },
    {
      "action": {
        "type": "click",
        "target_role": "button",
        "target_name": "Continue"
      },
      "explanation": "The childcare answer is complete, so I am moving to work status.",
      "postconditions": [
        {
          "type": "url_contains",
          "value": "#/work-status"
        }
      ]
    },
    {
      "action": {
        "type": "click",
        "target_role": "radio",
        "target_name": "Self-employed"
      },
      "explanation": "I selected Self-employed as the current work status."
    },
    {
      "action": {
        "type": "click",
        "target_role": "button",
        "target_name": "Continue"
      },
      "explanation": "The work status is complete, so I am moving to income.",
      "postconditions": [
        {
          "type": "url_contains",
          "value": "#/income"
        }
      ]
    },
    {
      "action": {
        "type": "type",
        "target_role": "textbox",
        "target_name": "Monthly income",
        "text": "2650"
      },
      "explanation": "I entered the monthly income for the self-employed route."
    },
    {
      "action": {
        "type": "click",
        "target_role": "button",
        "target_name": "Continue"
      },
      "explanation": "The income is complete, so I am moving to updates.",
      "postconditions": [
        {
          "type": "url_contains",
          "value": "#/updates"
        }
      ]
    },
    {
      "action": {
        "type": "click",
        "target_role": "radio",
        "target_name": "No"
      },
      "explanation": "I selected no email updates for this route."
    },
    {
      "action": {
        "type": "click",
        "target_role": "button",
        "target_name": "Continue"
      },
      "explanation": "The answers are complete, so I am moving to check answers.",
      "postconditions": [
        {
          "type": "url_contains",
          "value": "#/check-answers"
        },
        {
          "type": "text_present",
          "artifact": "reader_view",
          "value": "Self-employed"
        }
      ]
    },
    {
      "action": {
        "type": "finish",
        "summary": "I completed the self-employed route and reached the check-answers page with the route details visible."
      },
      "explanation": "The review page shows the self-employed route details clearly, so I am ending the task."
    }
  ]
}
