{
  "task_id": "webarena-map-search-cmu-from-home-001",
  "title": "Search For Carnegie Mellon University From The Map Home Page",
  "goal": "Search for Carnegie Mellon University from the WebArena map home page and stop on the resulting search-results view.",
  "instruction": "Open the self-hosted WebArena map home page, search for Carnegie Mellon University, and stop once the search results are visible.",
  "url": "http://localhost:3030/",
  "source": {
    "site_id": "webarena-verified-map",
    "site_name": "WebArena Verified Map",
    "category": "other",
    "redistribution_class": "redistributable_source"
  },
  "source_surface": "webarena-verified-map",
  "risk_level": "safe",
  "allowed_actions": [
    "type",
    "press",
    "finish"
  ],
  "difficulty_band": "hard",
  "difficulty_dimensions": {
    "authentication_required": false,
    "meaningful_action_count": 2,
    "cross_view_verification": false,
    "summary_edit_propagation": false,
    "conditional_ui": true,
    "async_or_modal": true,
    "dense_controls": false,
    "safety_boundary": false
  },
  "split": "dev",
  "stability_runs_passed": 1,
  "tags": [
    "recorded",
    "webarena",
    "map",
    "search",
    "hard"
  ],
  "review_notes": "First geocoder-backed home-page search task on the WebArena map source.",
  "success_assertions": [
    {
      "type": "url_contains",
      "value": "search?query=Carnegie%20Mellon%20University"
    },
    {
      "type": "field_value_equals",
      "match": {
        "role": "textbox",
        "name": "Search"
      },
      "value": "Carnegie Mellon University"
    },
    {
      "type": "text_present",
      "artifact": "reader_view",
      "value": "Search Results"
    },
    {
      "type": "text_present",
      "artifact": "reader_view",
      "value": "Carnegie Mellon University, Schenley Drive Extension, North Oakland, Pittsburgh, Allegheny County, 15213, United States"
    }
  ],
  "steps": [
    {
      "action": {
        "type": "type",
        "target_role": "textbox",
        "target_name": "Search",
        "text": "Carnegie Mellon University"
      },
      "explanation": "I entered the Carnegie Mellon University query into the map search box."
    },
    {
      "action": {
        "type": "press",
        "key": "Enter"
      },
      "explanation": "I submitted the search so the geocoder results page loads for Carnegie Mellon University.",
      "post_delay_ms": 9000,
      "postconditions": [
        {
          "type": "url_contains",
          "value": "search?query=Carnegie%20Mellon%20University"
        },
        {
          "type": "field_value_equals",
          "match": {
            "role": "textbox",
            "name": "Search"
          },
          "value": "Carnegie Mellon University"
        },
        {
          "type": "text_present",
          "artifact": "reader_view",
          "value": "Search Results"
        },
        {
          "type": "text_present",
          "artifact": "reader_view",
          "value": "Carnegie Mellon University, Schenley Drive Extension, North Oakland, Pittsburgh, Allegheny County, 15213, United States"
        }
      ],
      "postcondition_timeout_ms": 25000,
      "postcondition_poll_interval_ms": 500
    },
    {
      "action": {
        "type": "finish",
        "summary": "I searched for Carnegie Mellon University from the map home page and confirmed the search results are visible."
      },
      "explanation": "The Carnegie Mellon University results are visible now, so I am ending the task."
    }
  ]
}
