{
  "task_id": "cypress-rwa-bank-account-delete-save-verify-list-001",
  "title": "Delete A Bank Account And Verify It Disappears",
  "goal": "Sign in, delete the seeded bank account, and verify the deleted account no longer appears in the bank-account list.",
  "instruction": "Sign in to the self-hosted Cypress Real World App, open Bank Accounts, delete the seeded bank account Waters, King and O'Reilly Bank, and stop once the deleted account no longer appears in the bank-account list.",
  "url": "http://localhost:3000/signin",
  "source_surface": "cypress-realworld-app",
  "risk_level": "safe",
  "allowed_actions": [
    "click",
    "type",
    "finish"
  ],
  "difficulty_band": "hard",
  "difficulty_dimensions": {
    "authentication_required": true,
    "meaningful_action_count": 6,
    "cross_view_verification": false,
    "summary_edit_propagation": false,
    "conditional_ui": false,
    "async_or_modal": false,
    "dense_controls": true,
    "safety_boundary": false
  },
  "split": "dev",
  "stability_runs_passed": 1,
  "requires_source_reset": true,
  "tags": [
    "recorded",
    "modern-app",
    "authenticated",
    "bank-accounts",
    "mutating",
    "hard"
  ],
  "review_notes": "Reset-aware bank-account deletion task that verifies the seeded account disappears from the list.",
  "success_assertions": [
    {
      "type": "url_contains",
      "value": "http://localhost:3000/bankaccounts"
    },
    {
      "type": "text_present",
      "artifact": "reader_view",
      "value": "Waters, King and O'Reilly Bank (Deleted)"
    },
    {
      "type": "candidate_missing",
      "match": {
        "role": "button",
        "name": "Delete"
      }
    }
  ],
  "steps": [
    {
      "action": {
        "type": "type",
        "target_selector": "[data-test='signin-username'] input",
        "text": "Heath93"
      },
      "explanation": "I entered the seeded username for the local demo account."
    },
    {
      "action": {
        "type": "type",
        "target_selector": "[data-test='signin-password'] input",
        "text": "s3cret"
      },
      "explanation": "I entered the shared seeded password for the example user."
    },
    {
      "action": {
        "type": "click",
        "target_selector": "[data-test='signin-submit']"
      },
      "explanation": "I signed in so the authenticated bank-account tools can load.",
      "postconditions": [
        {
          "type": "text_present",
          "artifact": "reader_view",
          "value": "Account Balance"
        }
      ],
      "postcondition_timeout_ms": 10000,
      "postcondition_poll_interval_ms": 250
    },
    {
      "action": {
        "type": "click",
        "target_selector": "[data-test='sidenav-bankaccounts']"
      },
      "explanation": "I opened Bank Accounts from the side navigation so the seeded account and its delete control are visible.",
      "postconditions": [
        {
          "type": "url_contains",
          "value": "http://localhost:3000/bankaccounts"
        },
        {
          "type": "text_present",
          "artifact": "reader_view",
          "value": "Waters, King and O'Reilly Bank"
        }
      ],
      "postcondition_timeout_ms": 10000,
      "postcondition_poll_interval_ms": 250
    },
    {
      "action": {
        "type": "click",
        "target_selector": "[data-test='bankaccount-delete']"
      },
      "explanation": "I deleted the seeded bank account so I can verify it switches to the deleted state in the list.",
      "postconditions": [
        {
          "type": "text_present",
          "artifact": "reader_view",
          "value": "Waters, King and O'Reilly Bank (Deleted)"
        }
      ],
      "postcondition_timeout_ms": 10000,
      "postcondition_poll_interval_ms": 250
    },
    {
      "action": {
        "type": "finish",
        "summary": "I deleted the seeded bank account and verified it no longer appears in the bank-account list."
      },
      "explanation": "The seeded bank account is gone from the list now, so I am ending the task."
    }
  ]
}
